2009-01-01 05:06:00,2009,"Погрузив себя навеки во вселенский вечный анус,
бьется óб пол человек и зло взывает в мыслях к Богу:

— Дай войти еще раз в реку, и, клянусь, я там останусь!
Богу похуй. Имяреки недостойны диалога.

<span style=""font-size: 80%; color: #ccc;"">ни о чем не жалей, ни о чем не проси — с новым годом!</span>"
2009-01-15 15:14:00,Страшный суд,"Всё чаще думаю мелькóм про страшный суд,
не второпях, без суетливой резвости.
Склоню ли голову? Вина ли поднесут,
или придется отвечать по трезвости?

Придется ли мне вспомнить мою жизнь?
Какого ранга будут председатели?
Решетки ли на окнах, витражи ль?
смогу ли посмотреть в лицо предателям?
Усадят ли, иль на колени в пол?
То задрожу, то прокушу губу ли?
И кто-то в белом сунет корвалол,
или совсем иного зла пилюли?

Куда-то поведут, иль прямо там?
Дадут ли время попрощаться с близкими?
Расплатятся ли по моим счетам,
или вернут мне слезы обелисками?
Какого цвета стены? Есть жучки?
Подслушивают, всех ли? Тех, кто кается?
А самый главный — носит ли очки?
С прищуром смотрит, или улыбается?

Всё чаще думаю мелькóм про страшный суд,
нет времени конца, твержу упрямо я...
А после полечу, или понесут?
Или как встарь — как принято — над ямою?"
