2009-10-27 11:41:00,Грамматность,"<p>Грамотный человек — это больше, чем умение поставить запятую в нужном месте.</p>

<ul class='fancy'>
<li>Грамотный человек всегда справится с формулировкой так, чтобы не приходилось прибегать к смайлику. Шутка будет звучать иронично, хамство — цинично, глупость — категорично.</li>
<li>Практически все грамотные люди считают себя вправе ставить знаки препинания в соответствии с мелодикой речи; иногда — вопреки устоявшимся правилам языка. При этом, они всегда знают — «как правильно».</li>
<li>Грамотные люди, как правило, тяготеют к устаревающим словоформам; они бегло читают на дореформенном языке и горько жалеют о распространении δημοτικύ — вместо καθαρεύουσα, а также упрощении письменного немецкого за счет девальвации умляутов и ß.</li>
<li>Грамотный человек легко поддерживает беседу с представителями любого социального слоя — от профессора-литературоведа до спившегося сантехника.</li>
<li>Активный словарный запас грамотного человека практически равен пассивному.</li>
<li>Грамотный человек чувствует себя уязвленным и заинтригованным, если слышит незнакомое слово. Он обязательно переспросит собеседника, а по приходе домой — посмотрит в словаре все его значения и будет в течение недели им злоупотреблять. По прошествии этого периода — слово станет для него «обычным».</li>
<li>Наконец, грамотный человек обладает словарным запасом, позволяющим не прибегать к использованию одного и того же слова дважды в течение беседы.</li>
<li>Кроме прочего, кстати, грамотный человек знает, чем дефис (-) отличается от тире (—), а “английские” кавычки — от «русских» и »немецких«.</li>
</ul>"
2009-10-27 12:45:00,Искусство. Критерии.,"<div style=""border: 3px double rgb(204, 204, 204); margin: 0.2em 10em; padding: 0.4em; font-size: 140%; text-align: center;""><strong>Все гениальное — ново, но не все новое — гениально.</strong></div><div class=""ljtags""></div>"
2009-10-27 15:14:00,,"<div style=""border: 3px double rgb(204, 204, 204); margin: 0.2em 10em; padding: 0.4em; font-size: 140%; text-align: center;""><strong>Без промискуиментариев!</strong></div><div class=""ljtags""></div><div class=""ljtags""></div>"
2009-10-27 17:31:00,Этимология жизни,"<p><strong>Ирония</strong> (от <em>англ.</em> <a href=""http://www.merriam-webster.com/dictionary/iron"">iron, 2. а</a> — кандалы) — стилистический прием, позволяющий выставить собеседника идиотом (<em>поэт.:</em> заковать его уста в кандалы немоты) посредством полного перорального подавления, превентивного дезавуирования контекста, нивелирования дивергенции вербального потока и инкриминирования финитности умственного уровня.</p>"
2009-10-27 21:12:00,За чистоту языка!,"<span style=""color: #999; font-size: 85%;"">Ну, раз «<a href=""http://mudasobwa.livejournal.com/67998.html"">Грамматность</a>» вызвала столько откликов, вот вам еще старьё на ту же тему.</span>

<blockquote style=""border-left: 3px solid rgb(204, 204, 204); padding: 0.2em 1em; margin-left: 10em; font-style: italic;"">Прислали к нам сержанта из Москвы. Весьма интеллигентного юношу, сына писателя. Желая показаться завзятым вохровцем, он без конца матерился.
Раз он прикрикнул на какого-то зека:
— Ты что, ебну́лся?!
(Именно так поставив ударение.)
Зек реагировал основательно:
— Гражданин сержант, вы не правы. Можно сказать — ёбнулся, ебану́лся инаебну́лся. А ебну́лся — такого слова в русском литературном языке, уж извините, нет...

<span style=""color: #999; font-size: 85%;"">— © С. Д. Довлатов, «<a href=""http://lib.ru/DOWLATOW/zona.txt_with-big-pictures.html"">Зона</a>»</span></blockquote>

Дорогие мои москвичи!

Я отдаю себе отчет в том, что русский язык — непрост для изучения. Я не против вашей прагматичной привычки использовать название материала для обозначения всего, что из него сделано (кстати, поребрики уже лет восемьдесят делают не из бордюрного камня, а, натурально, из бетона — предлагаю теперь называть их бетоном). Я понимаю, что пока зажравшаяся питерская интеллигенция жила в квартирах с черным ходом, ваши прадеды ютились в свинарнях, к которым подойти было невозможно — только подъехать на тракторе (и, поэтому, принимаю из ваших уст слово «подъезд» — как единственно верное). Но одного я вам, как истинный ценитель русского языка, простить не могу.

Запомните:
<div style=""border: 3px double rgb(204, 204, 204); margin: 0.2em 10em; padding: 0.4em; font-size: 140%; text-align: center;""><strong>В русском языке нет слова пизди́ть в смысле врать.
В русском языке есть слово пи́здить в смыслах «бить» и «красть». И слово пизде́ть в смысле врать.</strong></div>

Для окончивших школу без медали напоминаю: глаголы нашего родного и всеми горячо любимого языка делятся, в частности, по спряжениям. Если личные окончания глагола ударные, то спряжение определяется по окончаниям. Глаголы с безударными окончаниями «-ить» — второго спряжения (есть несколько исключений, но они несущественны в рамках рассматриваемой задачи). Остальные глаголы с безударными окончаниями относятся к первому спряжению. У двусложных глаголов, заканчивающиеся на ударное «-ить» — во втором лице единственного числа ударение переходит на корень (ходи́ть — хо́дишь, люби́ть — лю́бишь, пили́ть — пи́лишь). Поэтому, если бы глагол «пизди́ть» существовал, то презрительное недоверие выражалось бы словоформой «пи́здишь».

Пожалуйста, поправляйте своих знакомых. Показывайте им этот текст. Ведь столь вопиющее бескультурие в обращении с нашим прекрасным языком бесит гораздо сильнее, чем незаметные ошибочки типа «одеть/надеть».

Спасибо."
2009-10-27 21:27:00,Вверх-вниз. Только не туда-сюда.,"Дорогие мои москвичи, приглашаю вас на занятие №2 курса лекций по русскому языку. Тема нашей сегодняшней лекции — названия направлений движения. Представьте себе, что мы вышли из замкадного леса и оказались в районе глубокой жопы Алтуфьево. Допустим, мы подошли к первому встречному и спросили его: «Простите, как пройти в библиотеку?». Не рассматривая здесь случаи стандартного поведения алтуфьевского прохожего (струйка слюны из уголка рта на асфальт, сопровождаемая презрительным «панаехали» и неумелой попыткой сымитировать хук слева), предположим, нам повезло, и случайный алтуфьевец решил нам помочь. Что же мы услышим в ответ? 

<em>— Идите вверх до фруктовой палатки, затем направо вниз до светофора и там увидите небольшое серое здание — это и есть библиотека.</em>

Давайте разберем это предложение.

Итак, «идите вверх». Геометрию начинают преподавать в пятом классе? А вам сейчас 26? 15 лет — достаточный срок для полного понимания значения слова «вверх». Для филологов и примкнувших к ним имбецилов — толкование понятия «аксонометрия» с цветными иллюстрациями есть в любом учебнике по черчению. Для структуральных лингвистов и аудиалов, поясняю: верх — это то, что вы увидите, задрав голову на 90° (перед тем, как ёбнуться на спину). Идти вверх человек не может. Вверх умеет летать ракета и стрелять дешевый китайский фейерверк, который вы так любите испытывать в новогоднюю ночь. Человек может идти вперед. То, что по пути следования ему придется преодолеть подъем, с незаметным глазу наклоном в 3° — на лингвистическую аксиоматику влияние не оказывает.

Далее. Палатка — это артефакт бессмысленного существования туристов. Это такой дырявый, провонявший костром и водкой кусок брезента, который сумасшедшие дизайнеры прошлого использовали для игры в оригами. Помните любимое развлечение детства — бумажные бомбочки с водой, которые так здорово сбрасывать с балкона на голову беспечным прохожим? — Это оно, только из линялой плащевки, и простроченное по краям грубой ниткой. Фруктовая палатка — это оно же, только сделанное из фруктов. Представили? Что нужно читать перед завтраком, чтобы предложить постороннему человеку в незнакомом городе — идти до «фруктовой палатки»? Я не знаю. На всякий случай поясню: правильно эта фраза звучит так: «пройдите прямо до фруктового ларька».

Двигаемся дальше. Про «направо вниз» я уже говорил, направо вниз смотрят мальчики-третьеклассники, сидящие за партой слева от девочки. Еще направо вниз хорошо подавать кий при выполнении бортового чужого. Направо вниз можно выйти по пожарной лестнице с десятого этажа отеля Рэдиссон-Славянская. Но по асфальту города можно идти только «направо вперед». Асфальт крепче человека, и пробуриться сквозь него вниз не удастся, если у вас, конечно, нет с собой в ридикюле отбойного молотка. Такова жизнь.

И, наконец. «Небольшое серое здание» — означает буквально «здание серого цвета и небольшого размера». Голубой пятиэтажный особняк с фасадом в шестнадцать окон, порталом и колоннадой — не небольшой и вовсе не серый. И ни постоянный смог над городом, превращающий картинку в черно-белый перманент, ни факт наличия зданий МИДа и Университета не сделает его «серым» и «небольшим».

Учите родной язык, и вам воздастся."
2009-10-28 13:33:00,,"<div style=""border: 3px double rgb(204, 204, 204); margin: 0.2em 
10em; padding: 0.4em; font-size: 140%; text-align: center;""><strong>Друг — это не тот, кого ты любишь, но тот, кто тебя терпит.</strong></div>"
2009-10-28 17:54:00,Прогресс налицо,"<p>О моей толерантности складывают легенды. Более терпимого человека, чем я — найти просто невозможно, разве что в египетских залах Эрмитажа, да в дальних палатах Ганнушкина. Любым шумным диспутам — я предпочитаю пение соловьев на майской рыбалке под Лугой.
Но сейчас я удержаться не могу. Мою лояльность постиг скоропостижный пиздец, в народе стыдливо именуемым катарсисом среднего возраста. А ведь зарекался за обедом читать советские живые журналы!
Некто <lj user=""asena""> <a href=""http://asena.livejournal.com/430127.html"">делится</a> с нами неприятной, в сущности, новостью. На пятом (питерском) канале закрывают некоторые передачи. Неприятный оскал волчьей жизни.<br/>Но каков слог! Вот краткая выжимка с моими нечленораздельными от обуявшего меня восторга — комментариями.<p>

<ul><li><strong>[…] Это […] <a href=""http://plobkov.livejournal.com/14257.html"">попало в блоги</a> и разошлось <a href=""http://www.lenizdat.ru/a0/ru/pm1/c-1081042-0.html"">по новостям</a></strong> — ссылки ведут на одну запись в блоге и одну новость на Лениздате (поднимите руку, кто его читает?);</li>
<li><strong>У Пятого канала действительно были низкие рейтинги, соответственно, низкие рейтинги были и у Прогресса</strong> — «Прогресс» — это название основного объекта радения. Но какова логика! Наш канал — говно, <em>поэтому</em> у нашей программы низкие рейтинги;</li>
<li><strong>Я совершенно уверена, что […] если бы руководство согласилось прорекламировать нас хотя бы в 
научно-популярных журналах, аудитория сразу увеличилась бы вдвое.</strong> — а я совершенно уверен, что на Марсе есть жизнь, и мне до фени астрономия (как и автору этого памфлета — маркетинг);</li>
<li><strong>[…] мы делали офигенную программу. Совершенно точно лучшую в России.</strong> — ну, тут понятно. Лохи-начальники не оценили, а лохи-зрители не знали;</li>
<li><strong>Мы сняли <a href=""http://www.5-tv.ru/programs/broadcast/502967/"">одомашненных лисиц</a>,
<a href=""http://www.5-tv.ru/programs/broadcast/503498/"">пчелиный социум</a>
и <a href=""http://www.5-tv.ru/programs/broadcast/503416/"">синантропных 
животных</a>.</strong> — вот тут я, честно сказать, был вынужден сходить выпить чашечку кофе и перекурить. Потому что стал всерьез опасаться за свою психику. У меня хорошее воображение, я стараюсь ему не подсовывать формулировки «пчелиный социум» и «синатропные животные» без нужды;</li>
<li><strong>Мы не пропадем без российского телевидения. А вот оно без нас теряет всякий смысл.</strong> — этот шедевр даже комментировать неохота. «Пафос подотрите», — говорил в таких случаях мой ротный.</li>
</ul>

<p>В общем, дорогие друзья, я рад, что эту передачу закрыли. Как и многие другие. Вообще, я бы все передачи закрывал бы на часок-другой, чтобы взглянуть на истинное лицо их создателей. Помните позор Диброва, брызгающего слюной в Парфенова в ночь «закрытия» НТВ? Ну чё, еще тогда про него все стало ясно. И говорил он приблизительно теми же словами. </p>

<p>Я не против хороших передач про «пчелиный социум», упаси меня литр от второго, но. Пусть эти профессионалы «не пропадают без телевидения» где-нибудь вдали от телевидения. А там, глядишь, лет через 300, и телевизор можно будет посмотреть.</p>"
2009-10-28 18:54:00,Редактор и корректор,"У русских две проблемы — «что делать» и «кто виноват». У хорошего текста — проблем не меньше: редакторы и корректоры. 

Намедни зачем-то опять <a href=""http://community.livejournal.com/pishu_pravilno/3850274.html?thread=71794722#t71794722"">влез в дискуссию</a> с людьми «ВИП» (расшифровка этого термина — «Вон Из Профессии»). В результате, сильно разболелся очередной шрам из перманентно ноющих. Это письмо я написал в редакцию журнала «Russian Digital», когда они без моего ведома покромсали мою статью почти вдвое.

<h4>Открытое письмо генеральному директору издательского дома СПН</h4>

Уважаемый Олег Владимирович!

Ряд корректив, внесенных без моего ведома в мою статью, опубликованную в январском номере журнала «Russian Digital», привели к тому, что любой вменяемый человек, прочитавший текст, справедливо сочтет меня идиотом.

Я вынужден зарабатывать деньги умственным трудом, поэтому сложившаяся ситуация меня не устраивает — как угрожающая моему благосостоянию. В связи с вышеизложенным я настоятельно прошу вас принять некоторые меры, способные исключить инциденты представления авторов вашего уважаемого издания имбецилами в дальнейшем:

   1. Переведите корректора со сдельной оплаты труда на повременку. Тогда он, расстроившись от отсутствия ошибок в оригинальном материале, возможно, не сочтет нужным вносить свои. В качестве превентивной меры передайте ему, пожалуйста, что стремительно устаревающая словоформа «сотоварищи» не нуждается в пробеле после неотделяемой приставки «со».
   2. Обяжите редактора при замене в тексте недопустимого наглого солипсизма автора «мне довелось видеть контору» на оригинальный и изящный оборот «в каждой уважающей себя компании» — вычитать абзац до конца. Это позволит избежать пассажей типа «обязанности сотрудников отдела тестирования заключаются в том, чтобы прийти на работу и восемь часов нарезать круги по трассе Need4Speed». Не все тестеры в мире заняты именно этим.
   3. Бессердечно отрезая чересчур лиричный, отвлеченный, ненужный и не влезший на разворот — последний абзац с абстрактной бессмысленной фразой про энтропию — безжалостно вымарывайте злосчастную энтропию и из первого абзаца. Такие причудливые ружья должны либо стрелять, либо отсутствовать.
   4. Выпуская статью, написанную «срочно в номер» в сентябре — в январе следующего года — пожалуйста, пробегитесь взглядом по временам глаголов. Пока вы телились, декабрьский фестиваль уже состоялся.
   5. И последнее. Разъясните верстке различие между интернетом и глянцевым журналом и обучите их ставить ударения вместо злоупотребления капслоком. Тем более, в оригинальном тексте, который вам предоставил я, «Контра́» была написана типографически верно. Если ваши верстальщики слишком тупы, научите их приему «копипейст» — его, как правило, осваивают даже волоокие секретарши.

Засим остаюсь искренне ваш,
.....А"
