2009-10-10 04:00:00,"Конечно, я шовинист","Проглядываю вот ленту тут, иногда случается. Некто, в публичном доступе, задает вопрос: «Друзья, а читаете ли вы чужие СМС?».
Ну, я человек азартный, заключаю сам с собой пари на пару пива: разгадаю ли по ответам, кто действительно не читает, а кто не признается? Открываю комментарии. И — первый же ответ: «<em>Конечно</em>, читаю! […]».

Это «конечно» — как серпом по органу чувства прекрасного, хоть и немало я в этой жизни повидал.

Я швыряю свой телефон где попало, хоть зачитайся. И, в общем, меня не сильно заденет, если кто-то будет использовать мои «входящие» вместо детектива на ночь. Меня немного настораживают люди, способные заглянуть в чужой телефон. Настораживают — но не более. (Сам я даже от экрана отворачиваюсь, если у кого-то на столе, например, зажужжало — но это мои личные тараканы, особая порода.) Кто-то чужие письма читает, кто-то чужую жену поёбывает в охотку, кто-то чужие лопатники к себе в карман перекладывает, кто-то чужие стихи к себе в тетрадочку на контрольной переписывает. Всякое бывает — на всех зла не затаишь; судить, кто прав, а кто нет — не мое это дело. Я вообще очень толерантен к людям, пока они пишут ярким русским языком и не будят меня до того, как я выпью кофе с сигаретой.

Но, бля, вот это «конечно» — это ниже нуля по Кельвину. Читающего чужие письма — я неохотно, но из-под обстрела вытащу. А тех, кто «<em>конечно</em>, читает» — своими руками готов под тот обстрел засунуть. Ну, если вы понимаете, о чем я."
2009-10-12 03:24:00,Эсперанто избыточен,"<blockquote cite=""http://www.lib.ru/ILFPETROV/author12.txt"" style=""border-left: 3px solid rgb(204, 204, 204); padding: 0.2em 1em; margin-left: 10em; font-style: italic;"">Словарь   Вильяма   Шекспира  по  подсчету  исследователей составляет 12 000 слов. Словарь негра  из  людоедского  племени &laquo;Мумбо-Юмбо&raquo; составляет 300 слов.<br />Эллочка Щукина легко и свободно обходилась тридцатью.<br /><span style=""color: rgb(153, 153, 153); font-size: 85%;""> — Ильф и Петров, &laquo;<a href=""http://www.lib.ru/ILFPETROV/author12.txt"">12 стульев</a>&raquo;</span></blockquote> <p>Осмелюсь доложить, что в качестве языкового средства может быть использован любой полный набор символов, если полнота его доказана эмпирически, либо теоретически.</p> <p>Ну, например, рассмотрим систему дорожных знаков. И, например, переведем на этот язык какую-нибудь песню. Например, любимого <a href=""http://ru.wikipedia.org/wiki/%D0%A4%D1%91%D0%B4%D0%BE%D1%80_%D0%A7%D0%B8%D1%81%D1%82%D1%8F%D0%BA%D0%BE%D0%B2"">Дядю Федора</a>:</p> <table border=""0"" style=""background-color: rgb(219, 209, 200); width: 500px; font-size: 110%; font-weight: bold;""><tbody> <tr><td style=""width: 200px; text-align: center;""><img border=""0"" width=""108"" height=""107"" src=""http://pics.livejournal.com/mudasobwa/pic/0000x471""/></td><td style="""">Двадцать пятого числа сего месяца</td></tr> <tr><td style=""width: 200px; text-align: center;""><img border=""0"" width=""112"" height=""98"" src=""http://pics.livejournal.com/mudasobwa/pic/0000y33d""/></td><td style="""">дворник</td></tr> <tr><td style=""width: 200px; text-align: center;""><img border=""0"" width=""84"" height=""109"" src=""http://pics.livejournal.com/mudasobwa/pic/0000zrdc""/></td><td style="""">старый</td></tr> <tr><td style=""width: 200px; text-align: center;""><img border=""0"" width=""83"" height=""114"" src=""http://pics.livejournal.com/mudasobwa/pic/00010etp""/></td><td style="""">во дворе у нас</td></tr> <tr><td style=""width: 200px; text-align: center;""><img border=""0"" width=""108"" height=""108"" src=""http://pics.livejournal.com/mudasobwa/pic/00011g4t""/></td><td style="""">повесился.</td></tr> <tr><td style=""width: 200px; text-align: center;""><img border=""0"" width=""109"" height=""105"" src=""http://pics.livejournal.com/mudasobwa/pic/00012yta""/></td><td style="""">Но не будем мы о нем горевать.</td></tr> <tr><td style=""width: 200px; text-align: center;""><img border=""0"" width=""112"" height=""98"" src=""http://pics.livejournal.com/mudasobwa/pic/0000y33d""/></td><td style="""">дворник</td></tr> <tr><td style=""width: 200px; text-align: center;""><img border=""0"" width=""84"" height=""109"" src=""http://pics.livejournal.com/mudasobwa/pic/0000zrdc""/></td><td style="""">старый</td></tr> <tr><td style=""width: 200px; text-align: center;""><img border=""0"" width=""105"" height=""99"" src=""http://pics.livejournal.com/mudasobwa/pic/00013bcw""/></td><td style="""">молодым вперед шагать!</td></tr></tbody></table> <lj-cut text=""есть еще :-)""><table border=""0"" style=""background-color: rgb(219, 209, 200); width: 500px; font-size: 110%; font-weight: bold;""><tbody> <tr><td style=""width: 200px; text-align: center;""><img border=""0"" width=""106"" height=""98""src=""http://pics.livejournal.com/mudasobwa/pic/0001475r"" /></td><td style="""">Баба на дороге</td></tr> <tr><td style=""width: 200px; text-align: center;""><img border=""0"" width=""109"" height=""98""src=""http://pics.livejournal.com/mudasobwa/pic/00015rfh"" /></td><td style="""">пьяная</td></tr> <tr><td style=""width: 200px; text-align: center;""><img border=""0"" width=""79"" height=""109""src=""http://pics.livejournal.com/mudasobwa/pic/00016h2z"" /></td><td style="""">валяется:</td></tr> <tr><td style=""width: 200px; text-align: center;""><img border=""0"" width=""111"" height=""108""src=""http://pics.livejournal.com/mudasobwa/pic/000175fh"" /></td><td style="""">фарами &mdash; вперед,</td></tr> <tr><td style=""width: 200px; text-align: center;""><img border=""0"" width=""95"" height=""56""src=""http://pics.livejournal.com/mudasobwa/pic/00018fr9"" /></td><td style="""">колесами &mdash; назад.</td></tr> <tr><td style=""width: 200px; text-align: center;""><img border=""0"" width=""79"" height=""79""src=""http://pics.livejournal.com/mudasobwa/pic/00019bzb"" /></td><td style="""">А мимо</td></tr> <tr><td style=""width: 200px; text-align: center;""><img border=""0"" width=""106"" height=""98""src=""http://pics.livejournal.com/mudasobwa/pic/0001475r"" /></td><td style="""">бабы той</td></tr> <tr><td style=""width: 200px; text-align: center;""><img border=""0"" width=""98"" height=""57"" src=""http://pics.livejournal.com/mudasobwa/pic/0001a7dk""/></td><td style="""">с песней боевой</td></tr> <tr><td style=""width: 200px; text-align: center;""><img border=""0"" width=""109"" height=""106"" src=""http://pics.livejournal.com/mudasobwa/pic/0001b97t""/></td><td style="""">шел</td></tr> <tr><td style=""width: 200px; text-align: center;""><img border=""0"" width=""109"" height=""106"" src=""http://pics.livejournal.com/mudasobwa/pic/0001c8zz""/></td><td style="""">партизанский</td></tr> <tr><td style=""width: 200px; text-align: center;""><img border=""0"" width=""111"" height=""97"" src=""http://pics.livejournal.com/mudasobwa/pic/0001dxx2""/></td><td style="""">отряд.</td></tr></tbody></table><p>Я мог бы все куплеты, разумеется, но надоело с картинками возиться (за которые, кстати, большое спасибо <a href=""http://www.online-avto.ru/lesson_461.htm"">http://www.online-avto.ru/lesson_461.htm</a>).</p></lj-cut> <p>Такие дела. Желающим могу перевести их любимые хиты.</p>"
2009-10-12 05:41:00,,"<div style=""border: 3px double rgb(204, 204, 204); margin: 0.2em 10em; padding: 0.4em; font-size: 140%; text-align: center;""><strong>ICQ: переписнись с другом!</strong></div>"
2009-10-12 06:34:00,Салатики для гостей,"При всей своей неизбывной интеллигентности, Немиров умудрялся никогда не быть чопорным. Помню, как-то мы шли с ним по Невскому, теплым летним вечером. В районе Грибоедова — нам наперерез внезапно бросилась барышня, в которой с расстояния пушечного выстрела угадывалась восторженная первокурсница психфака. Есть в них что-то такое, психическое. На первых курсах — преимущественно в повадках; у выпускниц — оно прокрадывается в глаза и душу. Улыбаясь нам так, словно мы только что подарили ей бриллиантовое колье, и испуганно смаргивая в сторону, она на едином дыхании выпалила в Витькину внимательную грудь: «Поцелуйте меня, пожалуйста!». Новобранцев там любят на такие социальные исследования отправлять — пехоту престижного вуза, пушечное мясо. Немиров сладко улыбнулся и ответил: «Милая барышня, я целоваться не умею, давайте я вас лучше выебу!». Хорошо, у меня с собой бутылка коньяка была — а то бы эта акула социальных исследований там до сих пор бы в обмороке лежала.

Тремя годами позже Витька позвал меня к себе в гости, как всегда без повода, но — вопреки обыкновению — заранее. Я удивился, но уточнять ничего не стал. В назначенный час я стоял перед дверью его квартиры, при галстуке и бутылке какого-то импортного пойла. Немиров открыл дверь в трусах, деловито забрал у меня бутылку и заорал своим немыслимым шепотом: «Через полчаса гости придут, а у меня еще даже салатов нет». Меня он не то, чтобы за гостя не посчитал — он меня вообще как будто не заметил. Серией наводящих вопросов мне удалось выяснить, что Витьке приглянулись одномоментно три девицы — и он, со свойственной ему прямотой, пригласил их на смотрины. Всех троих. Я ему был нужен как тамада и критик. Пребывая в легкой задумчивости, я вызвался помочь ему покрошить салатики, но он наотрез отказался, ибо в программу смотрин входил пункт «как эти курвы к холостяцкой стряпне». Я смирился и ушел в комнату.
Примерно через полчаса раздался звонок. Я поплелся открывать. На пороге стояли все три грации. То ли они сговорились, то ли оказались излишне пунктуальны. Все три — как на подбор, хоть сейчас на подиум, хоть сейчас в постель. Где Немиров умудрялся их находить, для меня всегда было загадкой.
Я галантно предложил им войти, помог раздеться. На Витькином фоне, я — даже при шикарном галстуке и природных ста девяноста сантиметрах — всегда выглядел щуплым замухрыжкой.
Мы вежливо толкались в прихожей, неловко путаясь в именах и местоимениях, когда распахнулась дверь кухни. Нашим взорам предстал Немиров, который, напомню, полчаса назад удалился туда делать салатики. Барышни об этом, понятно, не подозревали. На Витьке были все те же яркие семейные трусы в горошек, на лице — выражение восторга. В руке он держал наполовину пустую бутылку коньяка. Немиров оглядел наши смущенные расшаркивания покровительственным взглядом и изрек:
— Ага. Салатики. — Тут этот монстр похлопал свободной рукой себя по бедру и отхлебнул из горлышка. — Яйца, кстати, у меня уже есть."
2009-10-13 10:14:00,Долой нюансы!,"<blockquote style=""border-left: 3px solid rgb(204, 204, 204); padding: 0.2em 1em; margin-left: 10em; font-style: italic; font-size: 85%;"">Как известно, все люди делятся на три категории: тех, кто умеет считать и тех, кто не умеет. <span style=""color: #CCC;"">(© РНА)</span></blockquote>
Все люди так или иначе делятся на аристократов и плебеев. Среди представителей обоих подмножеств попадаются как богатые, так и нищие.
Богатые аристократы — приятны во всех отношениях; нищие плебеи — как правило — тоже. Разорившихся аристократов терпеть гораздо сложнее. Но нично не может сравниться по отвратительности с внезапно разбогатевшим плебсом."
2009-10-13 10:21:00,pro et contrafact,"Совершенно неожиданно, за утренней сигаретой, витая ленивыми мыслями где-то за горизонтом (читай: думая, как обычно, о бабах) — я, наконец, четко понял, почему все утверждения сторонников «свободной информации» в формулировке «я буду качать фильмы с торрентов» — насквозь лживы.
Дело в том, что у каждой медали есть два конца, а у каждой палки — две стороны. Эта проблема — не исключение, у нее две ипостаси. Субъективная, так сказать, и объективная.
Объективная всегда поднимается на щит сторонниками «контента на халяву»: студии зажрались, продавать надо не так, бла-бла-бла. Это верная точка зрения, кстати. Объективно — все так и есть.
Но! Есть ведь еще и субъктивная сторона. В смысле, это я — лично я — вчера посмотрел фильм, за который не заплатил ни копейки. И вот именно это (безотносительно объективной составляющей) — нормальному человеку должно быть западло.

Мой сосед Вася избивает жену, да, но это же не легитимизирует мои ежеутренние запои! Да, государство у нас — то еще в социальном плане (не только, конечно, в социальном, но сейчас именно про это), но зарплата в конвертике касается только меня, государство здесь ни при чем, не нужно искать оправданий на стороне. Это я утаил налоги, это я совершил преступление. Каким бы ни было государство, я не хочу мерить свои моральные качества по нему.

Так же и с торрентами. Я знаю миллион аргументов в пользу того, почему не имеет смысла ехать на Китай-город покупать лицензионный диск с фильмом, который мне внезапно втемяшилось посмотреть. Но ни один из них не проканает, когда я утром пойду бриться, взгляну себе в глаза и скажу: «Вчера, Лёха, ты спиздил вещь. Дорога в тысячу миль начинается с первого шага. Такие дела.»."
2009-10-13 12:37:00,Профессиоаналы своего дела,"Знаете, как отличить непрофессионала? — Очень просто. Покажите ему наполовину сделанный проект и спросите, что делать дальше. Если он скажет: «Это говно нужно полностью переделать с нуля» — перед вами тупой урод, гоните его в шею. Да, и к синдрому <a href=""http://en.wikipedia.org/wiki/Not_invented_here"">NIH</a> я тоже крайне малотолерантен.
Чего это я вдруг? Да вот, жизнь принесла еще один показательный пример.
Меня иногда просят помочь сделать «персональный сайт». Я часто соглашаюсь. Уточняю требования, которые всегда процентов на триста сорок покрываются возможностями <a href=""http://wordpress.org/"">Wordpress</a>. Настраиваю кросс-публикацию в ЖЖ. Подтачиваю какой-нибудь полюбившийся пациенту дизайн и передаю, так сказать, ключи. Как правило, в первые два-три месяца мне иногда задают мелкие уточняющие вопросы, на которые с легкостью можно ответить наобум. Именно простота использования при полном удовлетворении запросов и заставила меня остановиться на этом движке. Времена, когда я брался учить всех барышень вокруг перлу — в далеком прошлом.
Так было и на этот раз. Только барышня пошла немного дальше и обратилась к оптимизатору. Тот, разумеется, сказал, что с этим говном дела иметь не желает. А слово-то это — «оптимизация» — модное, мать его! А барышня доверчивая и до модных веяний жадная. Поэтому, вероятнее всего, в недалеком будущем прекрасно работающая домашняя страничка будет похерена, а на ее месте появится мертворожденный монстр, поддерживать который в актуальном состоянии будет не под силу не то, что владелице сайта, но и команде бородатых сисадминов. Зато он будет <em>легко оптимизируем</em>! Понимаете?

Что станет с автомехаником на сервисе, предложи он клиенту вместо замены масла — продать свое ведро и купить мэйбах? А с официанткой, которая в ответ на просьбу добавить побольше сахара — принесет вместо этой растворимой гадости — текилу? Почему у IT — какой-то особенный путь, почти как у России?

Уф. Спасибо, я выговорился.

<em>P. S.</em> Это не опечатка, там, в заголовке."
2009-10-13 14:11:00,Планы на завтра,"Давно хочу написать словарь эвфемизмов. В трех томах. В первом — будут собраны благозвучные, приятные уму и уху слова, наподобие глагола «остолбенело» в смысле «ах, граф, мне все остолбенело!». Во втором — уродцы, выдуманные ханжами с высшим филологическим. А вот в третьем! — в третьем я сделаю ласковую подборку идиоматических калек инфернально-интеллигентского происхождения, которыми адепты общественной морали и нравственности прикрывают неспособность формулировать мысли.
И самое почетное место в третьем томе займет статья про «у нас не принято» (в смысле «немедленно прекратите»). Сама по себе эта формулировка уже заставляет неискушенного общениями в свете человека усмехнуться: принять можно законопроект и на грудь. С «принять курить» как-то сложнее смириться. Да и кем принято? Кворум был? Срок действия не истек еще? — мрачной завесой тайны покрыты несуществующие ответы на эти вопросы. Я понимаю формулировку «у нас не курят». Когда мне так говорят в кафе, я разворачиваюсь и иду в соседнее. А вот сопли эти типа «не принято» — которые не вежливость ни разу (вежливо предложить курящему гостю пепельницу) — бесят непередаваемо. Запрещаешь мне насладиться единственной оставшейся мне радостью? — будь человеком раз в жизни, так и скажи: «Нельзя!». Нет, это противоречит нормам обхождения с гостями. Обезличенное «не принято» как бы снимает ответственность с цербера, делает его в его же глазах в один момент белым и пушистым. Только вот честность мне всегда была дороже этих реверансов в сторону общественной устойной нравственности.

Я, кстати, знаю, почему мне особенно противен этот инвалид речи. Мой чуткий лингвистический слух угадывает очевидное семантическое (и силлабическое, кстати) сходство между «у нас не принято» и «у нас не прибрано». А я не люблю, когда грязно."
