<p>Конверсия меня, признаться, удивила. Сейчас все, кто думает, что я съехал с глузду и решил таким экстравагантным способом стать тысячником — отправляются в жопу, а мы продолжаем. Так вот. Как социальная сеть ЖЖ — абсолютно несостоятелен. Четверо из пяти, заказавших эпиграмму (из которых двое даже поблагодарили), — абсолютно не заинтересованы в том, чтобы завтра увидеть что-то похожее уже <em>в своей</em> ленте. Статистика посещений у меня, естественно, отключена, но я уверен, что трое из этих четверых просто не удосужились полистать мой журнал. При этом, со своей стороны, могу сказать, что абсолютно бессмысленных журналов не было ни одного, то есть это все — живые люди, умеющие связно излагать свои мысли.</p>
<p>Даже эта малюсенькая выборка — наглядно дает понять, что аудитория здесь вышла на плато и закуклилась. К чему это я? Да ни к чему, просто стало интересно сравнить поведенческие шаблоны с 2002 годом. То ли мы постарели, то ли социальные сети как инструмент общения незнакомых людей — умирают, не родившись.</p>
<p>Чего это у меня заглавие на немецком, спросите вы? — Да просто выебнуться захотелось, да и одноименный фильм — прекрасен.</p>"
2012-04-09 06:45:00,Свадьба товарища Полянского,"<p>Волею судеб пришлось в воскресенье покататься по Москве. Я предполагал, что параллельно моему миру — существуют другие, непознанные; но не ожидал, что так близко.</p>
<p>В Марьино по-прежнему середина девяностых. Рыночки вокруг метро, небритые пацанчики в тренировочных штанах и куцых курточках с претензией на кожу: «Телефон дешево не нужен? А видеокамера?». Турецкое шмотьё, настолько синтетическое, что искрит, когда проходишь мимо. В Макдональдсе — семьи с детьми, сидящие друг у друга на головах, огромные очереди и охранник у туалета: «Только для посетителей». Пришлось отодвинуть его в сторону со словами: «Я в общественных уборных не ем». Подействовало.</p>
<p>На «штатном» выезде из огромного микрорайона — на Люблинской — в два часа дня в воскресенье — стоячая пробка на полчаса. Полчища тупых баранов, на китайских пародиях на внедорожники, едут по своим делам. Ясное дело, в метро-то только неудачники ездят, мы лучше выбросим в трубу половину своего выходного, но зато в тачиле: углекислый газ отечества нам слаще и приятнее. Чувствовал себя идиотом, приобщившимся. Ладно я не мог себе представить, что буду стоять днем в воскресенье на четырехполосном проспекте, — но они-то там живут!</p>
<p>В «Золотом вавилоне» — те же толпы, что в Макдональдсе. Люди гуляют семьями по торговому центру, вальяжно и с достоинством. Ресторанный дворик забит. На катке не протолкнуться. Пока добежал до нужного магазина и обратно — чуть не сшиб пару променадных девиц, глазевших на витрины то ли с нижним бельем, то ли с верхними сумочками.</p>
<p>В Медиа-маркте (это реклама: по мне, так лучший магазин электроники в России) какой-то мужик представительского вида выбирал телефон. По очкам видно, что чувак не бедствует. И по манерам. Вокруг — суетится прыщавый юный продавец. «А вы не хотите новый айфон посмотреть?». Мужик пружинисто поднимает голову, и глядя на это недоразумение поверх своих невозможных очков, жестко артикулируя, на пол-магазина объявляет: «Молодой человек, я — натурал». И продолжает рассеянно разглядывать витрину.</p>
<p>Когда я, уже возвращаясь домой, притормозил, чтобы выпустить выезжающих из переулка, — из машины сзади принялись яростно сигналить, а потом сделали попытку объехать меня по обочине. Я чувака аккуратно провез до начинавшейся через метров тридцать оградки и поехал себе дальше, что было с ним — не знаю.</p>
<p>Друзья, а как вы по Москве на машине ездите? И, главное, зачем? Это же такой ад, что никакого чистилища не надо.</p>"
2012-04-09 07:49:00,Троица,"<p>На станции ТО в Ростокино стоит аппарат, принимающий автоматические платежи. На главном экране три опции: «Оплатить штраф», «Оплатить ТО», «Поддержать „Спартак“».</p>
<p>Бог комбинаторики выбирает вариант: «Оплатить ТО „Спартаку“».
<br></p>"
2012-04-09 07:50:00,Четыре места,"<figure><img src=""http://mudasobwa.ru/i/busses-stop.jpg"" alt=""Стоянка сочлененных автобусов: четыре места.""><figcaption><p>Задание на дом: разбор сложносочлененного автобуса.</p></figcaption></figure>"
2012-04-09 09:21:00,Ксюша всё,"<p>Супруга с утра высказала очень здравую мысль.
<br></p>
<p>Передайте Ксении Анатольевне, пусть добьется аудиенции у Путина (думаю, ей это будет несложно) и на микрофон спросит: «Как давно вы перестали по утрам пить кровь невинных младенцев?».</p>
<p>Почти наверняка вождь не ответит напрямую. То-то радости будет у всей либеральной оппозиции, тема для разговоров еще месяца на три.
<br></p>"
2012-04-09 13:27:00,Еще пара слов,"В наше время болван с микрофоном в руках — страшнее обезьяны с гранатой. А уж как оправдываться начнут — вообще туши свет и выноси всех святых.

Выпускница МГИМО <a href=""http://sobchak-xenia.livejournal.com/5302.html"">вывесила</a> в своем журнальчике полотнище на пару тысяч знаков, по прочтении которого уже нестерпимо хочется плюнуть ей в рожу хотя бы за то, что она всех вокруг держит за имбецилов.
Оправдания эти мне очень напомнили <a href=""http://www.newsinfo.ru/articles/2011-08-29/travma_slovom/760607/"">скулеж Губерниева</a> после того, как он обосрался в прямом эфире.

Хорошо, подумалось мне, что они оба холостые. Осталось их поженить и запереть где-нибудь на необитаемом острове. Гребец-неудачник и единственная за всю историю славных вузов дамочка, которой удалось перевестись с факультета международных отношений СПбГУ — в МГИМО — на третьем году обучения без потери курса. Тогда, правда, ей не давали в руки микрофон, возможно, все дело в этом."
2012-04-09 14:59:00,…,"<div style=""border: 3px double rgb(204, 204, 204); margin: 0.2em 8em; padding: 0.4em; font-size: 140%; font-weight: bold; text-align: center;"">OOO «Информационная Компания»</div>"
2012-04-21 03:06:00,"Не перенимайте чужие привычки, они вам не идут","<p>Сегодня в разговоре употребил слово «шибболет». «Это что еще такое?» — переспросил собеседник. «Это тот же эндемик, — отвечаю. — Только мертвый и силлабического рода».</p>
<p>И это после того, как он мне рассказал прекрасную трогательную историю. Есть у меня такой любимый лингвистический штамп; я когда собираюсь выходить из дома, хлопаю себя по карманам, проверяя важное, и приговариваю: «<span style=""font-style: italic;"">Паспорт, ключи, кошелек, — взял; все остальное можно купить</span>». Этот знакомый когда-то давно мою привычку перенял. И иногда приговаривал, что она теперь экономит и ему — массу времени и нервов. Не с этого начал он наш последний разговор:
<br></p>
<p>— Сегодня, сука, я купил себе новые старые права и все документы на машину. Очень, сука, торопился.
<br></p>"
2012-04-21 09:37:00,Силлогизмы в защиту,"<p>Ладно, скажу и я пару слов про «Pussy Riot». Девки мне отвратительны, как и группа «Война», я не люблю, когда срут в подъездах. И, хотя Храм Христа Спасителя мне гораздо менее мил, чем приснопамятный Литейный мост, я нахожу естественным и очевидным для человеческой особи — не гадить даже в тех местах, где живут малосимпатичные люди.</p>
<p>Гораздо более отвратительна при этом мне позиция РПЦ. Не потому, что у девиц малые дети. Не потому, что т. н. панк-молебен был какой-то там акцией. Не потому, что были оскорблены миллиарды верующих.</p>
<p>Потому что они публично демонстрируют гордыню. Которая, если мне не изменяет память, типа, грех и всякое такое. Я ж математик, все-таки, поэтому не без доказательства:</p>
<blockquote><p>воздам каждому по делам его.</p><small>{Мф. 16:27.}</small>
<p>вошел Иисус в храм Божий и выгнал всех продающих и покупающих в храме, и опрокинул столы меновщиков и скамьи продающих голубей, и говорил им: написано, — дом Мой домом молитвы наречется; а вы сделали его вертепом разбойников.</p><small>{Мф. 21:12.}</small></blockquote>
<p>Из этого силлогизма безо всяких передергиваний следует, что там, где Иисус посчитал разумной мерой пресечения изгнание и проповедь — попы современности полагают, что разбираются в наказаниях лучше Сына Господня.</p>
<p>Просто удивительно, что никто до сих пор не удосужился это сформулировать.</p>"
2012-04-21 10:11:00,Как это мило!,"<p>Яндекс по запросу «<a href=""http://yandex.ru/yandsearch?text=%D1%88%D1%83%D1%82%D0%BA%D0%B8+%D0%BF%D1%80%D0%BE+%D1%8F%D0%B7%D1%8B%D0%BA%D0%B8+%D0%BF%D1%80%D0%BE%D0%B3%D1%80%D0%B0%D0%BC%D0%BC%D0%B8%D1%80%D0%BE%D0%B2%D0%B0%D0%BD%D0%B8%D1%8F&amp;lr=213&amp;xjst=1"">шутки про языки программирования</a>» — отдает <a href=""http://golang.org/"">официальный сайт Go</a> (языка, разработанного в Google) — на первой странице. Сейчас на девятом месте, среди всех остальных анекдотов. Тонко.</p>"
2012-04-21 14:49:00,…,"<div style=""border: 3px double rgb(204, 204, 204); margin: 0.2em 8em; padding: 0.4em; font-size: 20px; font-weight: bold; text-align: center;"">Вентилятор не мой, я лишь набросал говна́!</div>"
2012-04-23 08:18:00,Троица,"<p>Телевизор вчера сообщил в новостях: «„Ночные Волки“ собираются провести с РПЦ совместную акцию против гомосексуализма и педофилии».
<br></p>
<p>Кажется, потом выяснилось, что я слушал невнимательно, и это были заголовки нескольких разных сюжетов, но в первый момент я даже не удивился. Жаль, кистью и маслом не владею, а то прекрасный триптих вырисовывается, вместо устаревших МЭЛ: Путин, Хирург и Кирилл. Зеркало нашей эпохи.</p>
<p>Кстати, я только сейчас сообразил, что большевики даже в малом слепо копировали существующие (проверенные практикой) символы, и повсеместные портреты МЭЛ — та же троица.
<br></p>"
2012-04-23 10:34:00,Moose объелся Shoots,"<figure><img src=""http://mudasobwa.ru/i/1335162843-moose.jpg"" alt=""Moose объелся Shoots""><figcaption><p>Вечером, оказывается, их в Лосином острове — полно́. С голодухи выходят чуть ли не в город. На людей обращают внимания не больше, чем я — на симпатичных секретарш. Морды — величественно-индифферентные.</p></figcaption></figure>"
2012-04-23 12:26:00,Журналисты везде одинаковы,"<blockquote cite=""http://www.ubuntuvibes.com/2012/04/linus-torvalds-appreciates-ubuntus-user.html"" style=""border-left: 5px solid #EEEEEE; margin-bottom: 18px; padding-left: 15px; color: #888;""><p><i>TechCrunch:</i> I really think that Ubuntu has generally had the right approach, and been very user-centric.</p>
<p><i>Linus Torvalds:</i> The same thing is what frustrated me about many of the changes in Gnome 3. The whole “let’s make it clutter-free” was taken to the point where it was actually hard to get things done, and it wasn’t even obvious *how* to do things when you could do them. That kind of minimalist approach is not forward progress, it’s just UI people telling people “we know better”, even if it makes things harder to do. That kind of “things that used to be easy are suddenly hard or impossible” just drives me up the wall, and frustrates me.</p><small style=""color: #BFBFBF; display: block; font-size: 12px; font-weight: 300; line-height: 18px;"">— <a href=""http://www.ubuntuvibes.com/2012/04/linus-torvalds-appreciates-ubuntus-user.html"">http://www.ubuntuvibes.com/2012/04/linus-torvalds-appreciates-ubuntus-user.html</a></small></blockquote><br><p>Это фрагмент интервью Торвальдса — TechCrunch′у, по случаю вручения Линусу премии <a href=""http://www.technologyacademy.fi/millennium-technology-prize/"">Millenium Technology Prize</a>. Краткий перевод фрагмента:<br>— Правда ли, что подход Убунту очень правильный?<br>— Да я на стену лезу, когда сталкиваюсь с таким подходом.</p>
<p>Перепечатка интервью на <i>Ubuntu</i>Vibes (ссылка дана на нее) озаглавлена как? — Правильно: «Linus Torvalds Appreciates Ubuntu's User Centric Approach».</p>
<p>В оригинальном интервью еще про русского интервьюера смешно.</p>"
2012-04-24 16:00:00,Моральная дилемма,"Хорошему человеку, с которым я чуть менее, чем шапочно, — знаком, отправил резюме другой человек, про которого я понимаю, что он(а) — мудак.
Первый человек при этом вряд ли может это знать.
Второй человек, насколько могу судить, умеет производить впечатление адекватного.

Мучаюсь, даль ли ссылку на чудачества второго."
