2013-12-13 10:40:00,Слухи ширятся,"<p class=""owl"">Впервые я познакомился с миром сплетен довольно поздно. Несмотря на то,
что ненавязчивым тихоней научился прозябать только годам к тридцати. В школе,
как ни странно, я был фигурой довольно заметной. Видимо, ровно настолько,
чтобы нужды в сплетнях у окружающих не возникало вовсе. Я сам поставлял
достаточное для пересудов количество неоспоримых фактов.</p>
<p class=""owl"">Зачет по биологии, например, я получил за реплику в конкурсе капитанов
школьного КВНа. Посетовав на утерю любимым учителем вторичных половых признаков.
Тогда это казалось довольно смелым и оригинальным. Зал, естественно, заржал
(толпу вообще можно быстро расшевелить только паховыми областями).
Рассудительная и многое повидавшая биологичка сказала: «Судя по этому гоготу,
в терминологических отличиях бороды и яиц разбираешься здесь только ты».
И поставила трояк. (Я повторил этот трюк через год; биология — определенно не мой конек.
Вытянув на выпускном экзамене несчастливый билет, я сумел ответить только
на один вопрос из пяти, гласивший: «Укажите основную причину увеличения числа межвидовых
скрещиваний в последние двести лет?». Нашкрябав: «Падение нравов», я пошел
курить. Т. К. тяжело вздохнула, и обошлось без пересдачи.)</p>
<p class=""owl"">Так вот, в школе я как-то не сталкивался со сплетнями. У меня самого идиосинкразия
даже на попытки просто упомянуть имена третьих лиц в разговоре, друзья обсуждали
в то время преимущественно стихи Хлебникова и большую теорему Ферма. Врагов у меня,
кажется, не было никогда. Понятие «ходят слухи» ассоциировалось исключительно
с отменой талонов на водку.</p>
<p class=""owl"">И вот мы поступили в Политех и поехали в колхоз. Деревня Зверево, между Выборгом
и Приозерском. Двенадцать часов на поле. Из развлечений: флирт с поварихами из колхозной столовой
и гипотетическая вероятность ночных набегов местных.</p>
<p class=""owl"">Первые несколько дней мы привыкали к новому распорядку дня. Потом научились спать
в прицепе трактора, прямо на свежесобранной картошке. Распили ящик с местными и уладили все
конфликты. Отправили всех негодных к сбору урожая обратно в город. Быт даже как-то
наладился. Например, в нашем бараке появились занавески из найденной в сенях
мешковины.</p>
<p class=""owl"">И тут вдруг я заметил, что на меня как-то странно косятся однокурсники.
Некоторые неохотно здороваются за руку. Не зовут играть в лабиринт. Даже
сигареты почти перестали стрелять.</p>
<p class=""owl"">Я недоумевал несколько дней. Отчуждение ширилось. Наконец, я не выдержал
и припер в сенях одного из соседей по бараку, наименее рослого. «Что, — говорю —
происходит?». Угрозами и увещеваниями через час бестолкового мычания мне удалось
из него вытянуть первую более-менее осмысленную фразу. «Мы все понимаем, но ты бы
хоть за барак бы заходил». Чтобы не пересказывать всю ту галиматью, которую он нес,
подробно, перейду сразу к сути: оказывается, я каждую полночь выхожу на крыльцо,
онанировать на полную луну. Все уже знают.</p>
<p class=""owl"">Будучи начинающим поэтом в душе и бригадиром на поле, я четко следовал разумному
распорядку дня: до полуночи писал символистским хореем про крестьянский труд
(такого рода тренировке меня научили летом в ЛИТО), а с сигналами точного времени
радио «Маяк» закуривал, выходил на свежий воздух, отливал в канаву и отправлялся спать. Чтобы
в шесть поднять наших разгильдяев к завтраку. Такая изобретательная трактовка
моих действий, как полнолунный фетишизм, мне, признаться, в голову не пришла бы
даже под общим наркозом.</p>
<p class=""owl"">Я приложил некоторые усилия и разыскал автора этой саги. С единственной целью:
уточнить побудительные мотивы. Я не уводил у него жену, не крал кошелек; мы вообще
практически не общались. Честно говоря, я так и не понял тогда, зачем ему это
было нужно.</p>
<p class=""owl"">Зато с тех пор я отношусь к любым рассказам от третьего лица с равными долями
презрения и недоверия. Ничего паскудного не нашептывают лишь про абсолютно
никчемных людишек.</p>"
2013-12-13 12:37:00,Страшная перспектива,"Оригинал взят у <lj user=""m_yu_sokolov"" /> в <a href=""http://m-yu-sokolov.livejournal.com/2812627.html"">Страшная перспектива</a>

<div class=""repost"">Хорошо бы В. В. Путину уйти в отставку. Поскольку блогосфера являет картину «Ночью ли днем, только о нем», при удалении В. В. Путина от дел, разразится идейно-художественный кризис огромной силы. Прогрессивные мыслители возопиют: «На кого же ты нас покидаешь? Кого же мы теперь будем денно и нощно сволочить?».</div><br/>"
2013-12-13 16:42:00,Ореол ареала,"<p class='owl'>Давно обратил внимание на забавную особенность столичных аксакалов. В Москве
принято мериться километражом удаления от центра. То есть, эндемики Бульварного
кольца немного снисходительно поглядывают на внутрисадовых; все вместе они
ухмыляются в сторону бирюлевских и теплостанных.</p>
<p class='owl'>В Ленинграде я подобного не встречал. Мой друг жил на Староневском, я сам —
на Коломенской, а наши одноклассники — кто на Ваське, кто в Купчино, кто у Сосновки.
Как только мне выдалась такая возможность (то есть в неполные семнадцать лет) —
я переехал на Гражданку: поближе к институту, да и деревья в количестве больше
одного на гектар. Мне даже в голову бы не пришло упоминать о своем особенном
ленинградстве в контексте «я живу в трех минутах ходьбы от Восстания».</p>
<p class='owl'>А москвичи почему-то любят бравировать своей близостью к нулевой миле. Первое
время я недоумевал и расспрашивал, мол, а чем Китай-город лучше Бутово
  <em>в смысле проживания</em>? Ну, кроме того, что исторически известен как
гигантская помойка и неблагополучное место (если верить Гиляровскому)?
А потом привык. Но до сих пор, встречая в интернетах показную гордость
местом рождения, немного стесняюсь; видится мне в этом что-то неясное,
а недосказанности я недолюбливаю.</p>
<p class='owl'>Может быть, вы знаете, в чем тут дело? Расскажите, а?</p>"
2013-12-14 09:59:00,HORECA Ad,"<p class=""owl"">Успешные менеджеры человеческих кризисов рассказывают, что работу необходимо
менять раз то ли в два года, то ли в пять лет. Желательно, переезжая при этом
с насиженного места в какие-нибудь неведомые ебеня. Десять лет назад у меня
сама собой получилась передислокация из Берлина обратно в Питер; я задумался
и о смене работы. Будучи человеком довольно импульсивным, я решил тренировать
прыжки сразу с десятиметровой вышки. Не задаваясь особенно вопросом, когда
в бассейн нальют воду. Я решил некоторое время поработать копирайтером.</p>
<p class=""owl"">Как ни странно, меня взяли в «SPN Ogilvy». Хотя первое собеседование напоминало
сценку из раннего Монти Пайтона.
  <br>
  — А где вы работали до этого?
  <br>
  — В Берлине.
  <br>
  — Кем?
  <br>
  — Руководителем отдела разработки GUI-приложений.
  <br>
  — Простите?</p>
<p class=""owl"">В общем, меня взяли. На испытательный срок. На зарплату, напомнившую мне
беззаботный девяносто первый. Я тогда подрабатывал разгрузкой вагонов.
Коллектив был довольно пестрый, менеджеры считали копирайтеров людьми
немного не первого сорта; копирайтеры менеджеров попросту тихо презирали.
Что, учитывая их средний интеллектуальный уровень, было довольно предсказуемо.</p>
<p class=""owl"">На мой первый самостоятельный проект прикрепили самого лояльного менеджера:
интеллигентного мальчика из хорошей семьи, тихого и усердного. За три дня
до первой встречи с клиентом я не смог придумать ничего внятного. Художник
нарисовал какую-то херню по моим бессвязным репликам. Менеджер старательно
разбавил весь этот бред маркетинговым суржиком в пропорции примерно сто к одному,
упаковал в красивую папку с логотипом конторы и мы поехали к заказчику.</p>
<p class=""owl"">Мне было откровенно стыдно. Ранее мне не доводилось проваливать тестовые
задания (не считая того случая с Анжелой из Первомеда). Я хорошо понимал,
что мы везем на демонстрацию заводчику питбулей — найденного в последний
момент на помойке дворового пса. Менеджер сохранял невозмутимый вид, хотя я
видел: ему тоже неловко, просто он не хотел обижать несуразного новичка.</p>
<p class=""owl"">И тут меня осенило. В голове родилась идея рекламной кампании, целиком,
от первого подвала в глянце до последнего билборда на Невском. Я выдохнул
прямо в снулое ухо моего менеджера:
  <br>
  — Есть. Сейчас приезжаем, ты просто все время молчи. Я все сделаю как надо. Поверь.</p>
<p class=""owl"">Он лишь удрученно кивнул. Большую гадость, чем та, что лежала у нас в папке,
мне придумать не удалось бы даже под дулом пистолета.</p>
<p class=""owl"">Через пять минут мы рассаживались перед генеральным директором. Исподтишка
выложив толстую папку с приготовленным договором, менеджер взглянул на меня.
Я изучал заказчика. Он показался мне вменяемым. Контора занималась
видеонаблюдением под ключ для отелей, ресторанов, казино. Я еще раз выдохнул
и сказал:
  <br>
  — Мы привезли вам план-проект, техническое задание, договор. Придраться к нам
невозможно. Но я хотел бы вам предложить сначала меня выслушать. Я собираюсь
сказать вещь, узнай о которой мой шеф — он меня немедленно уволит. В этой папке
лежит говно. Но пока мы сюда ехали, я все придумал. У меня нет ни эскизов,
ни плана, ни ТЗ, ничего. Но если вы хотите, чтобы все было круто — выслушайте
меня.</p>
<p class=""owl"">Чувак незаметно усмехнулся и кивнул. Удивить его было непросто: в этом бизнесе
редко появляются люди с хрупкой душевной организацией, да еще и с такими
красочными шрамами на лбу. Я слышал, как хрустят костяшки пальцев моего менеджера.</p>
<p class=""owl"">Я рассказал все, что придумал по дороге. Почти не сбиваясь. Рисовал эскизы
прямо на проекте нашего договора (что оказалось немного рискованным шагом, поскольку
рисовать я не умею вовсе). Расписывал прелести решения. Вдохновенно врал
про фокус-группы, распределение Гаусса и данные с несуществующих аналитических
сайтов. Размахивал руками. Подозреваю, что, раскрасневшись, я стал похож на
бабуина даже больше, чем обычно.</p>
<p class=""owl"">Когда я закончил, заказчик снял очки. Мизинцем отодвинул от себя папку с
заготовленным планом. Спросил: «Насколько
  <em>это</em>
  (взмах руками) будет дороже
  <em>этого</em>
  (брезгливый тычок в непрочитанную папку)?». Менеджер опомнился,
впрыгнул в родное седло и выпалил: «В полтора раза».</p>
<p class=""owl"">Мы пожали друг другу руки и поехали выполнять.</p>
<p class=""owl"">Кампания удалась; шеф заметил мою маленькую победу: я получил премию размером
в сто долларов. Спустя неделю после запуска заказчик позвонил мне лично.
Сказал, что отправил мне односолодовый презент. Я сдержанно поблагодарил.
Тогда он внезапно спросил:
  <br>
  — Слушай, а ты не знаешь, случайно, кого-нибудь, кто мог бы с твоей
наглостью мне разработку сопутствующего ПО подрихтовать?</p>
<p class=""owl"">Так я вернулся в IT.</p>"
2013-12-14 10:00:00,…,"<div style=""border: 3px double rgb(204, 204, 204); margin: 0.2em 8em; padding: 0.4em; font-size: 20px; font-weight: bold; text-align: center;"">Лев «Warld» Толстой</div>"
2013-12-16 08:56:00,Политический момент импульса,"<p class=""owl"">В моей стране в последние девяносто пять лет неблагополучно. Связано это, в основном,
с реформой Луначарского (человека, который позже чуть не похоронил кириллицу).</p>
<p class=""owl"">Всеобщая грамотность — штука полезная, но покупка галстука осмысленна после смены
армяка на камзол, а не вместо нее. К счастью, неподалеку от Кремля в то время
оказался Максим Горький, составивший список лучших книг всех времен. На основе
этого списка строится школьная программа по литературе по сию пору. Что было бы,
если бы у Горького был плохой вкус — страшно себе представить, но сейчас не об этом.</p>
<p class=""owl""><strong>Грамотные люди приятны любой власти тем, что им легче скармливать агитационные
материалы.</strong></p>
<p class=""owl"">Взгляд, конечно, варварский. Но верный.</p>
<p class=""owl"">Умение читать, к сожалению, не гарантирует умение понимать прочитанное. Более того,
разбирать по буквам слова и складывать их в предложения можно заставить кого угодно.
Думать же, к сожалению, способны немногие. Сила печатного слова такова, что
с лихвой компенсирует недостаток смысла и полное отсутствие логики. Человек так
устроен: в хорошие известия мы верим охотно. А «хорошие» в данном контексте
означает «нравящиеся лично нам».</p>
<p class=""owl"">Мы за последние сто лет привыкли к тому, что нам рассказывают только хорошее.
Напоминаю: «объективно хорошего» в мире так мало, что новостей не хватит и
на один пятиминутный выпуск в год. СМИ вынуждены выбирать свою аудиторию
и лить разные сорта бальзама в уши конкретных групп людей. Газеты
«Правобережная Правда» и «Ложь левого берега» читает малопересекающаяся
публика. А что владелец у этих изданий один… ну, чтобы
  <em>осознать</em>
  эту
обескураживающую информацию — одной грамотности мало.</p>
<p class=""owl"">Именно поэтому в интернетах так популярны битвы за судьбы России, все аргументы
в которых сводятся к ссылкам на популярные издания и апелляциям к тем или иным
сомнительным листовкам. Вася хочет одного, и верит одним глашатаям; Петя —
обратного, и его данные почерпнуты из совсем иных источников.</p>
<p class=""owl"">Партийные бонзы рассвета СССР хорошо понимали, что без поддержки интеллигенции
долго не протянешь, особенно на мировой арене. Интеллигенция, ко всеобщему
раздражению, грамотна настолько, что способна не только разбирать по слогам
чужие лозунги, но и тиражировать на бумаге свои. Пока страна не накачала
бицепсы, на интеллигенцию велась охота; слишком многие прогрессивно мыслящие
неумные люди на этот пропагандистский сироп купились.</p>
<p class=""owl"">То же самое происходит и сейчас. Ведь с развитием интернета все стало гораздо
проще. Люди сначала выбирают сердцем, а потом начинают жечь глаголом.
Громадная проблема заключается в том, что думать нас за последние сто лет
так и не научили. Все усилия вбухали в грамотность, вот и расхлебываем.
К сожалению, творческий человек редко способен рассуждать здраво.</p>
<p class=""owl"">Зато смена амплуа с кухонного поэта для элиты на буревестника миллионов —
заманчива экспоненциальным расширением аудитории. Лозунги людям по-прежнему
ближе и понятнее, чем желеобразные эклоги.</p>
<p class=""owl"">В общем, я это к чему. Мне жаль, что Быков поставил крест на своем даровании.
Писать такое говно с проходными рифмами, как он это делает в последнее время,
в состоянии любой трудолюбивый человек, немного чувствующий вкус толпы.
Поэт, в моем понимании, должен быть параллелен политике. Иначе в тридцать семь
лет потянет встать под пистолет.</p>
<p class=""owl"">Представьте себе элегию Уистана Одена, в которой двадцать три раза встречается
фамилия «Nixon».</p>"
