2014-03-14 11:29:00,Мечты,"Если бы сейчас нашелся бы какой-нибудь альтруист-энтузиаст, выкупил бы ЖЖ и закрыл его нахуй без предварительного объявления — ему бы на Страшном Суде все грехи бы не глядя списали.

Более человечного поступка сегодня и представить себе невозможно."
2014-03-15 08:29:00,BTW,"Если кто-то по каким-то причинам хочет читать мои тексты, это всегда можно сделать по адресу http://mudasobwa.ru

Спасибо за внимание."
2014-03-18 17:34:00,BCN,http://meme-me.ru/bcn/
2014-03-26 16:53:00,Напишу пераžком краткое содержание любого сюжета,"Да, это снова шведский стол."
