2014-05-01 09:08:00,Первое правило русского языка,"<img src=""http://ic.pics.livejournal.com/mudasobwa/18658516/33576/33576_original.png"" alt=""Первое правило русского языка: первый результат выдачи Google"">

Бирман, хочешь, линк на therules.ru к себе поставлю?

——————————————————————————————————————

BTW, я регулярно обновляю http://mudasobwa.ru"
2014-05-12 16:21:00,му-редупликация,"Оригинал взят у <lj user=""harald_halti"" /> в <a href=""http://harald-halti.livejournal.com/80275.html"">му-редупликация</a><div class=""repost"">Редупликацией (от латинского reduplicatio &mdash; удвоение) в лингвистике называется удвоение начального слога, основы или слова. Редупликация может быть полной, когда копируется вся единица целиком, неполной, когда копируется только ее часть, а также неточной, когда единица повторяется с искажениями. Редупликация встречается практически во всех языках.

В русском языке имеются три модели неточной правой редупликации (при которой искажается второе слово):
1. м-редупликация (зелень-мелень, картошка-мартошка, шашлык-машлык);
2. шм-редупликация (танцы-шманцы, тортик-шмортик, бренди-шменди, чай-шмай);
3. хуй-редупликация (улица-хуюлица, автобус-хуёбус).

Третья модель очень простая и предусматривает замену первого слога копируемого слова русским словом &quot;хуй&quot;, в связи с чем снижается серъезность восприятия понятия либо появляется пейоративный смысл при искажении имен и фамилий.
Вторая модель заимствована из разговорного идиша и выполняет аналогичные функции.
Первая модель заимствована в результате контакта с представителями азиатских и кавказских регионов.

Сходство значений первой и второй моделей позволяет заподозрить и сходное происхождение. И таки да! В идише имеется слово &quot;шмок&quot; (ид. &rlm;שמאָק&lrm; shmok), означающее &quot;остолоп&quot; и &quot;хуй&quot;. Таким образом, шманцы второй модели соответствуют хуянцам третьей модели. Успешное нахождение этимологического объяснения инициали шм- заставляет внимательно присмотреться к первой модели на предмет того, не вылезет ли из-за инициали м- еще один хуй.

<lj-cut>В тюркских языках изменяемым компонентом чаще всего является согласная &quot;м&quot; (хотя встречаются также &quot;п&quot; и &quot;б&quot;), при этом такая неточная редупликация придает выражению функции множественности и собирательности (в казахском языке: жыл-кы &mdash; &quot;лошадь&quot;, жылкы-мылкы &mdash; &quot;лошади и другой скот&quot;; туйе &mdash; верблюд, туйе-муйе &mdash; &quot;верблюды и другой скот&quot;; в турецком языке: kitap &mdash; &quot;книга&quot;, kitap mitap &mdash; &quot;книги и другие книги&quot;, adam &mdash; &quot;человек&quot;, adam madam &mdash; &quot;человек и другие люди&quot;). Этимология данной модели непонятна.

Олжас Сулейменов, сравнив базовую лексику современных тюркских и шумерского языков, выдвинул предположение о родстве шумерского и прототюркского языков. В связи с этим имеет смысл поискать объяснение в шумерском языке, в котором, действительно, обнаруживается модель образования инклюзивного множественного числа помощью точной редупликации (udu &mdash; &quot;баран&quot;, udu-udu &mdash; &quot;бараны, включая всех имеющихся в виду&quot;). При этом никакой неточной редупликации в имеющемся корпусе шумерских клинописных текстов не обнаруживается. Казалось бы, это тупик. Но тут имеет смысл вспомнить, что шумерский язык неоднороден, и наряду с основным диалектом эмегир (eme-gir<sub>15</sub>), на котором написано большинство дошедших до нашего времени текстов, имелся еще и диалект, а точнее, социолект (т. н. &quot;женский язык&quot;) эмесаль (eme-sal), на котором в текстах говорили женщины, богини и певчие gala (вероятно, кастраты), характеризовавшийся измененной фонетикой. Стоит добавить, что в текстах упоминаются также eme.gal &quot;большой язык&quot;, eme.sukud(-da) &quot;высокий язык&quot;, eme.suh(-a) &quot;изысканный язык&quot;, eme.te.na &quot;искаженный язык&quot;, а также профессиональные жаргоны eme.m&aacute;.lah4.a &quot;язык моряков&quot;, eme.udula &quot;язык пастухов&quot;, eme.nu.&egrave;&scaron;a &quot;язык жрецов Nue&scaron;&quot;, которые до нас не дошли.

Так вот, в языке эмесаль, в котором слова образуются по модели замещения первой части слова или первого слога, наибольшая доля дошедших до нас слов начинается со слога mu (ĝiš-bar (огонь) — mu-bar, ĝeštin (виноград) — mu-tin и т.д.). При этом это самое mu обозначается на письме идеограммой MU <img alt="""" border=""0"" height=""30"" src=""http://psd.museum.upenn.edu/epsd/psl/img/popup/Ogis.png"" title="""" /> и означает... Правильно! Это слово означает &quot;хуй&quot;!

Таким образом, можно предположить существование в шумерском языке модели образования множественного числа из одинаковых слов диалектов эмегир и эмесаль, которую можно назвать му-редупликацией, на основании которой образовалась тюркская модель м-редупликации. Эта му-модель не подтверждается известными (мне, во всяком случае) клинописными текстами, но, учитывая, что дошедшие до нашего времени шумерские тексты являются, по большей части, официальными царскими и храмовыми записями, не содержащими живой народной лексики, неудивительно, что она в них не попала. В общем, куда ни ткнись, везде торчат хуи!</lj-cut></div><br/>"
2014-05-12 18:19:00,Сы́рая Швейцария,"Швейцария, конечно, уже свою минуту славы на сто лет вперед получила год назад, но это никак не умаляет заслуги Белоруссии. Просто молодцы. Четвертый гол — вообще шедевр. И выстояли ведь, суматошно, нелепо, но — выстояли.

Прекрасный шанс выйти с третьего места: финны пока не смотрятся, а в немцев как-то традиционно не верится."
2014-05-14 21:49:00,Сообщества,"Создал еще одно сообщество: <lj comm=""ru-bcn"" />.

Надо сказать, мои сообщества всегда были популярнее моего журнала. И <lj comm=""ru-de"" /> (пока я не уехал из Германии), и http://clubs.ya.ru/hell-kitchen/ (даже без моего участия) — живут и процветают.

Ну вот, почему бы не возлюбить троицу?"
2014-05-17 08:42:00,ШС,"У нас снова шведский стол. Просите.


Правила узнаются по тегу.

Тема, автор, стиль — задаются вами, текст — мной."
2014-05-29 08:38:00,"Какого Пушкина ты мне, бля, тут читаешь?","<i>Эх, такой челлендж пропадает, хоть в Новосибирск езжай! Это же просто мечта шведского повара: я бы весь день слонялся от станции к станции и пятистопноямбил наобум Лазаря (в честь главного строителя московского метро).</i>

В очко можно прекрасно поиграть с товарищами, опять же. Угадали — пять очков, не угадали — одно. 

@<lj user=""mosmetro"" />: <a href=""http://mosmetro.livejournal.com/607193.html"">В новосибирское метро будут пускать бесплатно за стихотворение Пушкина</a><p align=""justify"">&nbsp;&nbsp;&nbsp;В Пушкинский день, который в России ежегодно отмечают 6 июня, проезд в Новосибирском метрополитене будет бесплатным, но только для тех, кто прочтёт не менее двух строф из сочинений А.С.Пушкина наизусть.<br>&nbsp;&nbsp;&nbsp;В этот день Новосибирский метрополитен совместно с фондом «Родное слово» проведёт акцию «Читаем Пушкина в метро». Акция будет проходить с 10 до 16 часов на семи станциях метро Новосибирска. «Контролёрами» выступят волонтеры: преподаватели русского языка, студенты-филологи, библиотекари и старшеклассники.</p>"
2014-05-31 19:24:00,Загадка,"Как выглядит сей монумент с тыльной, простите, стороны?

<img src=""http://ic.pics.livejournal.com/mudasobwa/18658516/33998/33998_600.jpg"" alt=""Ass as it is"" title=""Памятник Лене Миро в Барселоне"">"
